handle,product_id,position,scene,filename,source_hero_url,fal_url,local_path,score,match,reason,status,retries,timestamp
ceiling-grids-sound-acoustic-dampeners-orb,9832623735097,2,studio-white,ceiling-grids-sound-acoustic-dampeners-orb__pos2__studio-white.jpg,https://cdn.shopify.com/s/files/1/0859/0413/0361/files/business-interiors-16-x16-ceiling-grids-sound-acoustic-dampeners-orb-42575583215929.jpg?v=1759098231,https://v3b.fal.media/files/b/0a9869d0/wedgcIJqUH-xdxRO91Qfs_625a510204ee4b8cb56628af3abd1b5a.jpg,/Users/leokatz/Desktop/Office Central/data/img2img/phase1/batch-11/ceiling-grids-sound-acoustic-dampeners-orb__pos2__studio-white.jpg,9,True,The generated image is a near-perfect match to the reference product in all observed aspects.,OK,0,20260430-235019
ceiling-grids-sound-acoustic-dampeners-orb,9832623735097,3,sceneA-institutional,ceiling-grids-sound-acoustic-dampeners-orb__pos3__sceneA-institutional.jpg,https://cdn.shopify.com/s/files/1/0859/0413/0361/files/business-interiors-16-x16-ceiling-grids-sound-acoustic-dampeners-orb-42575583215929.jpg?v=1759098231,https://v3b.fal.media/files/b/0a9869d1/ET9cAD2BdmplbRA0hgX1c_5ab058f4e39845dc82314d7a8a70dda9.jpg,/Users/leokatz/Desktop/Office Central/data/img2img/phase1/batch-11/ceiling-grids-sound-acoustic-dampeners-orb__pos3__sceneA-institutional.jpg,9,True,"The generated image accurately matches the reference product in form, color, material, and proportions.",OK,0,20260430-235019
ceiling-grids-sound-acoustic-dampeners-orb,9832623735097,4,sceneB-smb,ceiling-grids-sound-acoustic-dampeners-orb__pos4__sceneB-smb.jpg,https://cdn.shopify.com/s/files/1/0859/0413/0361/files/business-interiors-16-x16-ceiling-grids-sound-acoustic-dampeners-orb-42575583215929.jpg?v=1759098231,https://v3b.fal.media/files/b/0a9869d2/IyILnjR23GgahhzbbWT4R_f68030fc06204688942664cc679da2d5.jpg,/Users/leokatz/Desktop/Office Central/data/img2img/phase1/batch-11/ceiling-grids-sound-acoustic-dampeners-orb__pos4__sceneB-smb.jpg,10,True,The product in image B perfectly matches the product in image A in all visual aspects.,OK,0,20260430-235019
desk-top-divider-divide,9693141827897,2,studio-white,desk-top-divider-divide__pos2__studio-white.jpg,https://cdn.shopify.com/s/files/1/0859/0413/0361/files/Desk-Top-Divider-DIVIDE-Business-Interiors-16731440.jpg?v=1750121211,https://v3b.fal.media/files/b/0a9869bd/9IALI-chMVq8qWOOQJhBt_c068a474b381422aa6376c74408d10bb.jpg,/Users/leokatz/Desktop/Office Central/data/img2img/phase1/batch-11/desk-top-divider-divide__pos2__studio-white.jpg,7,True,"The generated image closely matches the reference image in form, color, material, and proportions, with minor variations in lighting and context.",OK,0,20260430-235019
desk-top-divider-divide,9693141827897,3,sceneA-institutional,desk-top-divider-divide__pos3__sceneA-institutional.jpg,https://cdn.shopify.com/s/files/1/0859/0413/0361/files/Desk-Top-Divider-DIVIDE-Business-Interiors-16731440.jpg?v=1750121211,https://v3b.fal.media/files/b/0a9869be/0lj_6jK6qoHnHwVYVnF_F_b05ede1a06ab4dd9a1308f6cc33e63a2.jpg,/Users/leokatz/Desktop/Office Central/data/img2img/phase1/batch-11/desk-top-divider-divide__pos3__sceneA-institutional.jpg,9,True,"The generated image accurately depicts the product in terms of form, color, material, hardware, and proportions, creating a faithful representation in an office context.",OK,0,20260430-235019
desk-top-divider-divide,9693141827897,4,sceneB-smb,desk-top-divider-divide__pos4__sceneB-smb.jpg,https://cdn.shopify.com/s/files/1/0859/0413/0361/files/Desk-Top-Divider-DIVIDE-Business-Interiors-16731440.jpg?v=1750121211,https://v3b.fal.media/files/b/0a9869c0/fNfT7Ne6LRqeTvLToDfkP_3266d682402f44e6a6abf927757c4f1a.jpg,/Users/leokatz/Desktop/Office Central/data/img2img/phase1/batch-11/desk-top-divider-divide__pos4__sceneB-smb.jpg,1,False,"The generated image has a wooden frame and black background, while the reference image shows a metal frame and white background.",FLAG_HUMAN,0,20260430-235019
electric-dual-monitor-height-adjustable-standing-desk-workstation-dc450,9103473934649,2,studio-white,electric-dual-monitor-height-adjustable-standing-desk-workstation-dc450__pos2__studio-white.jpg,https://cdn.shopify.com/s/files/1/0859/0413/0361/files/Electric-Dual-Monitor-Height-Adjustable-Standing-Desk-Workstation-DC450-Business-Interiors-16692480.jpg?v=1750113078,https://v3b.fal.media/files/b/0a9869cc/AlV0H4VhC7Icfr_5ed4T__f90ff114ab80430991e82917bbaa32f9.jpg,/Users/leokatz/Desktop/Office Central/data/img2img/phase1/batch-11/electric-dual-monitor-height-adjustable-standing-desk-workstation-dc450__pos2__studio-white.jpg,8,True,"The generated image closely matches the reference product in form, color, material, and proportions with only minor differences in the display content and slight variations in the stand's positioning.",OK,0,20260430-235019
electric-dual-monitor-height-adjustable-standing-desk-workstation-dc450,9103473934649,3,sceneA-institutional,electric-dual-monitor-height-adjustable-standing-desk-workstation-dc450__pos3__sceneA-institutional.jpg,https://cdn.shopify.com/s/files/1/0859/0413/0361/files/Electric-Dual-Monitor-Height-Adjustable-Standing-Desk-Workstation-DC450-Business-Interiors-16692480.jpg?v=1750113078,https://v3b.fal.media/files/b/0a9869ce/6l-0C3BfhUlHs74xAMI3y_94c47b76d8f14405b5575952358fd95f.jpg,/Users/leokatz/Desktop/Office Central/data/img2img/phase1/batch-11/electric-dual-monitor-height-adjustable-standing-desk-workstation-dc450__pos3__sceneA-institutional.jpg,9,True,"The generated image accurately depicts the product from the reference image in terms of form, color, material, hardware, and proportions.",OK,0,20260430-235019
electric-dual-monitor-height-adjustable-standing-desk-workstation-dc450,9103473934649,4,sceneB-smb,electric-dual-monitor-height-adjustable-standing-desk-workstation-dc450__pos4__sceneB-smb.jpg,https://cdn.shopify.com/s/files/1/0859/0413/0361/files/Electric-Dual-Monitor-Height-Adjustable-Standing-Desk-Workstation-DC450-Business-Interiors-16692480.jpg?v=1750113078,https://v3b.fal.media/files/b/0a9869cf/oiDkC0R9uHYDqzeSPFELx_4f9a6fd7d4e94c68abca1db65101aecc.jpg,/Users/leokatz/Desktop/Office Central/data/img2img/phase1/batch-11/electric-dual-monitor-height-adjustable-standing-desk-workstation-dc450__pos4__sceneB-smb.jpg,8,True,"The generated image accurately depicts the reference product's form, color, material, and proportions, with minor differences in surrounding context and lighting.",OK,0,20260430-235019
global-accord-back-knee-tilter-chair-1,9639652557113,2,studio-white,global-accord-back-knee-tilter-chair-1__pos2__studio-white.jpg,https://cdn.shopify.com/s/files/1/0859/0413/0361/files/Global-Accord-Back-Knee-Tilter-Chair-Business-Interiors-16696635.jpg?v=1750114030,https://v3b.fal.media/files/b/0a9869b7/T0yp7rJ70wx4LZdlV7sjm_b7c9f204790549febbf1f057ec5ea717.jpg,/Users/leokatz/Desktop/Office Central/data/img2img/phase1/batch-11/global-accord-back-knee-tilter-chair-1__pos2__studio-white.jpg,9,True,The product in B nearly perfectly matches the product in A in all aspects tested.,OK,0,20260430-235019
global-accord-back-knee-tilter-chair-1,9639652557113,3,sceneA-institutional,global-accord-back-knee-tilter-chair-1__pos3__sceneA-institutional.jpg,https://cdn.shopify.com/s/files/1/0859/0413/0361/files/Global-Accord-Back-Knee-Tilter-Chair-Business-Interiors-16696635.jpg?v=1750114030,https://v3b.fal.media/files/b/0a9869bb/guNscLEZUswmFIdRnU-zI_e6b88e61afc345b6a2f07785a0047401.jpg,/Users/leokatz/Desktop/Office Central/data/img2img/phase1/batch-11/global-accord-back-knee-tilter-chair-1__pos3__sceneA-institutional.jpg,9,True,"The chair in image B closely matches the form, colour, material, hardware, and proportions of the product in image A.",OK,0,20260430-235019
global-accord-back-knee-tilter-chair-1,9639652557113,4,sceneB-smb,global-accord-back-knee-tilter-chair-1__pos4__sceneB-smb.jpg,https://cdn.shopify.com/s/files/1/0859/0413/0361/files/Global-Accord-Back-Knee-Tilter-Chair-Business-Interiors-16696635.jpg?v=1750114030,https://v3b.fal.media/files/b/0a9869bc/153_hYD5ryXvCTY25rrHS_07c0fb061384483bb674e9cd40142dfe.jpg,/Users/leokatz/Desktop/Office Central/data/img2img/phase1/batch-11/global-accord-back-knee-tilter-chair-1__pos4__sceneB-smb.jpg,8,True,"The generated image closely resembles the reference product in form, color, material, and proportions, with only minor differences in lighting and texture detail.",OK,0,20260430-235019
height-adjustable-table-5-sizes,9687458873657,2,studio-white,height-adjustable-table-5-sizes__pos2__studio-white.jpg,https://cdn.shopify.com/s/files/1/0859/0413/0361/files/Electric-Height-Adjustable-Sit-to-Stand-Desks-Business-Interiors-16722765.png?v=1750119363,https://v3b.fal.media/files/b/0a986999/Ys0LrKaBlyet_QC54T4QI_9f7995e23bef4a6fa12b1e15b841833a.jpg,/Users/leokatz/Desktop/Office Central/data/img2img/phase1/batch-11/height-adjustable-table-5-sizes__pos2__studio-white.jpg,10,True,"The product in B perfectly matches the product in A in form, color, material, hardware, and proportions.",OK,0,20260430-235019
height-adjustable-table-5-sizes,9687458873657,3,sceneA-institutional,height-adjustable-table-5-sizes__pos3__sceneA-institutional.jpg,https://cdn.shopify.com/s/files/1/0859/0413/0361/files/Electric-Height-Adjustable-Sit-to-Stand-Desks-Business-Interiors-16722765.png?v=1750119363,https://v3b.fal.media/files/b/0a98699a/YD1sLRib-oJPAYxtc8TkJ_09c2b0413806458bb70dea4195947cac.jpg,/Users/leokatz/Desktop/Office Central/data/img2img/phase1/batch-11/height-adjustable-table-5-sizes__pos3__sceneA-institutional.jpg,7,True,"The generated image is a good representation of the product, with minor differences in tabletop color and material texture.",OK,0,20260430-235019
height-adjustable-table-5-sizes,9687458873657,4,sceneB-smb,height-adjustable-table-5-sizes__pos4__sceneB-smb.jpg,https://cdn.shopify.com/s/files/1/0859/0413/0361/files/Electric-Height-Adjustable-Sit-to-Stand-Desks-Business-Interiors-16722765.png?v=1750119363,https://v3b.fal.media/files/b/0a98699b/iymr4UnRGldo-KO1fed2N_c656180898ec4f04a02ff7456eafa65f.jpg,/Users/leokatz/Desktop/Office Central/data/img2img/phase1/batch-11/height-adjustable-table-5-sizes__pos4__sceneB-smb.jpg,3,False,"The color and material of the tabletop are significantly different, and the hardware control panel is not visible in the generated image.",FLAG_HUMAN,0,20260430-235019
impromptu-lectern-1,9693075505465,2,studio-white,impromptu-lectern-1__pos2__studio-white.jpg,https://cdn.shopify.com/s/files/1/0859/0413/0361/files/Impromptur-Lectern-Business-Interiors-16728851.png?v=1750120654,https://v3b.fal.media/files/b/0a9869da/iMSee_5hjnp0kWTV9H0hF_ae5ab6e2fde34659898691b5f7389b5a.jpg,/Users/leokatz/Desktop/Office Central/data/img2img/phase1/batch-11/impromptu-lectern-1__pos2__studio-white.jpg,9,True,"The generated product in B nearly perfectly matches the reference product in A in terms of form, color, material, hardware, and proportions.",OK,0,20260430-235019
impromptu-lectern-1,9693075505465,3,sceneA-institutional,impromptu-lectern-1__pos3__sceneA-institutional.jpg,https://cdn.shopify.com/s/files/1/0859/0413/0361/files/Impromptur-Lectern-Business-Interiors-16728851.png?v=1750120654,https://v3b.fal.media/files/b/0a9869db/9SsXyasP9tR352_cIfzgX_bb0e25932bc0497f987a9164e42dc1f3.jpg,/Users/leokatz/Desktop/Office Central/data/img2img/phase1/batch-11/impromptu-lectern-1__pos3__sceneA-institutional.jpg,9,True,"The generated image accurately represents the product from the reference image in terms of form, color, material, hardware, and proportions.",OK,0,20260430-235019
impromptu-lectern-1,9693075505465,4,sceneB-smb,impromptu-lectern-1__pos4__sceneB-smb.jpg,https://cdn.shopify.com/s/files/1/0859/0413/0361/files/Impromptur-Lectern-Business-Interiors-16728851.png?v=1750120654,https://v3b.fal.media/files/b/0a9869dc/Tlbc9QN8ZdqM_4ASNA9GJ_d6d3138e954c42b3b3ce37beef233699.jpg,/Users/leokatz/Desktop/Office Central/data/img2img/phase1/batch-11/impromptu-lectern-1__pos4__sceneB-smb.jpg,10,True,"The generated image accurately depicts the product in the reference image with perfect matching in form, color, material, hardware, and proportions.",OK,0,20260430-235019
koko-tables,9820585525561,2,studio-white,koko-tables__pos2__studio-white.jpg,https://cdn.shopify.com/s/files/1/0859/0413/0361/files/KOKO-Tables-Business-Interiors-16788087.png?v=1750133045,https://v3b.fal.media/files/b/0a9869b2/mrFKekfjq_YMEm36sm-tC_68034d67cbd645d6ae724aab58ceee68.jpg,/Users/leokatz/Desktop/Office Central/data/img2img/phase1/batch-11/koko-tables__pos2__studio-white.jpg,9,True,"The generated image accurately replicates the form, color, material, and proportions of the reference product's tables.",OK,0,20260430-235019
koko-tables,9820585525561,3,sceneA-institutional,koko-tables__pos3__sceneA-institutional.jpg,https://cdn.shopify.com/s/files/1/0859/0413/0361/files/KOKO-Tables-Business-Interiors-16788087.png?v=1750133045,https://v3b.fal.media/files/b/0a9869b3/WUcueICaWzdROxtwV660U_d590e78c42f1450094958bc925bf6962.jpg,/Users/leokatz/Desktop/Office Central/data/img2img/phase1/batch-11/koko-tables__pos3__sceneA-institutional.jpg,7,True,"The generated image depicts tables that closely match the form, material, and proportions of the reference product, with slight variations in color representation.",OK,0,20260430-235019
koko-tables,9820585525561,4,sceneB-smb,koko-tables__pos4__sceneB-smb.jpg,https://cdn.shopify.com/s/files/1/0859/0413/0361/files/KOKO-Tables-Business-Interiors-16788087.png?v=1750133045,https://v3b.fal.media/files/b/0a9869b4/iMFQWNxCmguKbP50AXU8t_8aa1d15677cf48c4ad8122f27e62a52c.jpg,/Users/leokatz/Desktop/Office Central/data/img2img/phase1/batch-11/koko-tables__pos4__sceneB-smb.jpg,1,False,The product in B is a large conference table with a different design and structure than the small side tables depicted in A.,FLAG_HUMAN,0,20260430-235019
laminate-lockers-1,9822327505209,2,studio-white,laminate-lockers-1__pos2__studio-white.jpg,https://cdn.shopify.com/s/files/1/0859/0413/0361/files/Laminate-Lockers-Business-Interiors-16788815.png?v=1750133237,https://v3b.fal.media/files/b/0a98699d/WypqOHC9fXTAjVtCgJzUm_28f6358a2c9349988d270c9bf6b2d383.jpg,/Users/leokatz/Desktop/Office Central/data/img2img/phase1/batch-11/laminate-lockers-1__pos2__studio-white.jpg,9,True,"The generated image accurately replicates the form, color, material, hardware, and proportions of the reference product.",OK,0,20260430-235019
laminate-lockers-1,9822327505209,3,sceneA-institutional,laminate-lockers-1__pos3__sceneA-institutional.jpg,https://cdn.shopify.com/s/files/1/0859/0413/0361/files/Laminate-Lockers-Business-Interiors-16788815.png?v=1750133237,https://v3b.fal.media/files/b/0a98699e/FVl2ZVU_YWx_V2s2tUYR__f64ed86a63fe483a8ddeece65d52a62d.jpg,/Users/leokatz/Desktop/Office Central/data/img2img/phase1/batch-11/laminate-lockers-1__pos3__sceneA-institutional.jpg,9,True,"The generated image closely matches the reference product in form, color, material, and hardware with minor proportional differences in the locker height.",OK,0,20260430-235019
laminate-lockers-1,9822327505209,4,sceneB-smb,laminate-lockers-1__pos4__sceneB-smb.jpg,https://cdn.shopify.com/s/files/1/0859/0413/0361/files/Laminate-Lockers-Business-Interiors-16788815.png?v=1750133237,https://v3b.fal.media/files/b/0a98699f/vf4ZxeVlka42bd9vmUXzQ_2f94f1f4b59c4d80a762ecb79d830013.jpg,/Users/leokatz/Desktop/Office Central/data/img2img/phase1/batch-11/laminate-lockers-1__pos4__sceneB-smb.jpg,9,True,"The generated image accurately depicts the product from the reference image in terms of form, color, material, hardware, and proportions.",OK,0,20260430-235019
lockers-2-tier,9868797346105,2,studio-white,lockers-2-tier__pos2__studio-white.jpg,https://cdn.shopify.com/s/files/1/0859/0413/0361/files/business-interiors-1-bank-assembled-lockers-2-tier-42814958534969.png?v=1759098252,https://v3b.fal.media/files/b/0a986995/kwHjRwwIHUh7uRb9VXoFR_9c1d540ba692442fbeb5a1e15dfaac50.jpg,/Users/leokatz/Desktop/Office Central/data/img2img/phase1/batch-11/lockers-2-tier__pos2__studio-white.jpg,7,False,The generated image shows one open shelving section instead of the expected two closed locker doors.,OK,0,20260430-235019
lockers-2-tier,9868797346105,3,sceneA-institutional,lockers-2-tier__pos3__sceneA-institutional.jpg,https://cdn.shopify.com/s/files/1/0859/0413/0361/files/business-interiors-1-bank-assembled-lockers-2-tier-42814958534969.png?v=1759098252,https://v3b.fal.media/files/b/0a986996/cQCFLGtQfhmNFGJsgEo1O_67baed07d0b948ea81440cd9955cdae6.jpg,/Users/leokatz/Desktop/Office Central/data/img2img/phase1/batch-11/lockers-2-tier__pos3__sceneA-institutional.jpg,10,True,"The generated product in B is an exact replica of the reference product in A in terms of form, color, material, hardware, and proportions.",OK,0,20260430-235019
lockers-2-tier,9868797346105,4,sceneB-smb,lockers-2-tier__pos4__sceneB-smb.jpg,https://cdn.shopify.com/s/files/1/0859/0413/0361/files/business-interiors-1-bank-assembled-lockers-2-tier-42814958534969.png?v=1759098252,https://v3b.fal.media/files/b/0a986998/buQsWNnxQx4vN-dbnsedg_2d2345f0e21141c1a7d9f64a3705227c.jpg,/Users/leokatz/Desktop/Office Central/data/img2img/phase1/batch-11/lockers-2-tier__pos4__sceneB-smb.jpg,9,True,"The generated product closely matches the reference product in all aspects, only differing in color due to the material and context.",OK,0,20260430-235019
lotus-dx-sit-stand-workstation-dual-monitor-arm-extra,9667830776121,2,studio-white,lotus-dx-sit-stand-workstation-dual-monitor-arm-extra__pos2__studio-white.jpg,https://cdn.shopify.com/s/files/1/0859/0413/0361/files/Lotus-DX-Sit-Stand-Workstation-_Dual-Monitor-Arm-Extra_-Business-Interiors-16708472.png?v=1750116257,https://v3b.fal.media/files/b/0a9869c1/8DtExza2haXinWceQ03CP_c22a2105f40a45718a684139290452ea.jpg,/Users/leokatz/Desktop/Office Central/data/img2img/phase1/batch-11/lotus-dx-sit-stand-workstation-dual-monitor-arm-extra__pos2__studio-white.jpg,3,False,"The generated image shows the product in an office context, but key details like the branding and some design elements on the desk do not match the reference product.",FLAG_HUMAN,0,20260430-235019
lotus-dx-sit-stand-workstation-dual-monitor-arm-extra,9667830776121,3,sceneA-institutional,lotus-dx-sit-stand-workstation-dual-monitor-arm-extra__pos3__sceneA-institutional.jpg,https://cdn.shopify.com/s/files/1/0859/0413/0361/files/Lotus-DX-Sit-Stand-Workstation-_Dual-Monitor-Arm-Extra_-Business-Interiors-16708472.png?v=1750116257,https://v3b.fal.media/files/b/0a9869c2/ffDc2xnVxlv5tzE_qrzJp_8cc77c87aee147e4b0882557cad4baf0.jpg,/Users/leokatz/Desktop/Office Central/data/img2img/phase1/batch-11/lotus-dx-sit-stand-workstation-dual-monitor-arm-extra__pos3__sceneA-institutional.jpg,9,True,"The generated image accurately depicts the product from the reference image in terms of form, color, material, and proportions.",OK,0,20260430-235019
lotus-dx-sit-stand-workstation-dual-monitor-arm-extra,9667830776121,4,sceneB-smb,lotus-dx-sit-stand-workstation-dual-monitor-arm-extra__pos4__sceneB-smb.jpg,https://cdn.shopify.com/s/files/1/0859/0413/0361/files/Lotus-DX-Sit-Stand-Workstation-_Dual-Monitor-Arm-Extra_-Business-Interiors-16708472.png?v=1750116257,https://v3b.fal.media/files/b/0a9869c3/JtFqArH1TH8NIviVa0XCM_368a9cd1420f4d9abc096d8e91cb45f7.jpg,/Users/leokatz/Desktop/Office Central/data/img2img/phase1/batch-11/lotus-dx-sit-stand-workstation-dual-monitor-arm-extra__pos4__sceneB-smb.jpg,9,True,"The generated image accurately depicts the product from the reference, matching its form, color, material, and proportions.",OK,0,20260430-235019
manual-height-adjustable-base,9882644414777,2,studio-white,manual-height-adjustable-base__pos2__studio-white.jpg,https://cdn.shopify.com/s/files/1/0859/0413/0361/files/office-central-brant-business-interiors-default-title-manual-height-adjustable-base-tops-sold-separately-43007489245497.png?v=1759098250,https://v3b.fal.media/files/b/0a9869d3/bxMw9wsmTrifDvLUCGS53_0d67061f40b943eda653695acd5924b9.jpg,/Users/leokatz/Desktop/Office Central/data/img2img/phase1/batch-11/manual-height-adjustable-base__pos2__studio-white.jpg,9,True,"The generated product in B closely matches the reference product in A in terms of form, color, material, hardware, and proportions.",OK,0,20260430-235019
manual-height-adjustable-base,9882644414777,3,sceneA-institutional,manual-height-adjustable-base__pos3__sceneA-institutional.jpg,https://cdn.shopify.com/s/files/1/0859/0413/0361/files/office-central-brant-business-interiors-default-title-manual-height-adjustable-base-tops-sold-separately-43007489245497.png?v=1759098250,https://v3b.fal.media/files/b/0a9869d5/A3XsBQICLhPqui_MP5Mey_7ab585ed49c0410ca91945cd0eb6ee5e.jpg,/Users/leokatz/Desktop/Office Central/data/img2img/phase1/batch-11/manual-height-adjustable-base__pos3__sceneA-institutional.jpg,8,True,"The desk frame in image B closely resembles the product in image A in form, color, material, and proportions.",OK,0,20260430-235019
manual-height-adjustable-base,9882644414777,4,sceneB-smb,manual-height-adjustable-base__pos4__sceneB-smb.jpg,https://cdn.shopify.com/s/files/1/0859/0413/0361/files/office-central-brant-business-interiors-default-title-manual-height-adjustable-base-tops-sold-separately-43007489245497.png?v=1759098250,https://v3b.fal.media/files/b/0a9869d6/G914jVqObVoBy85pB1jZ0_7746943b7f874776a9448533ff5b752c.jpg,/Users/leokatz/Desktop/Office Central/data/img2img/phase1/batch-11/manual-height-adjustable-base__pos4__sceneB-smb.jpg,3,False,"The generated image depicts a different type of desk base, lacking the crank mechanism and appearing to only have a single central support column.",FLAG_HUMAN,0,20260430-235019
napa-boardroom-conference-table,9724981215545,2,studio-white,napa-boardroom-conference-table__pos2__studio-white.jpg,https://cdn.shopify.com/s/files/1/0859/0413/0361/files/Napa-Boardroom-Conference-Table-Business-Interiors-16745453.jpg?v=1750124200,https://v3b.fal.media/files/b/0a9869c8/rM5Ck4cPCXM-EZlHze5G7_7939fc272ee9411bb17262befdbdc1d1.jpg,/Users/leokatz/Desktop/Office Central/data/img2img/phase1/batch-11/napa-boardroom-conference-table__pos2__studio-white.jpg,9,True,"The generated image closely matches the reference product in all aspects, including form, color, material, hardware, and proportions.",OK,0,20260430-235019
napa-boardroom-conference-table,9724981215545,3,sceneA-institutional,napa-boardroom-conference-table__pos3__sceneA-institutional.jpg,https://cdn.shopify.com/s/files/1/0859/0413/0361/files/Napa-Boardroom-Conference-Table-Business-Interiors-16745453.jpg?v=1750124200,https://v3b.fal.media/files/b/0a9869ca/i1NC1CXluHNdLu-y_GoqQ_414bde72a3994c0c953dbb570858ed47.jpg,/Users/leokatz/Desktop/Office Central/data/img2img/phase1/batch-11/napa-boardroom-conference-table__pos3__sceneA-institutional.jpg,9,True,"The generated table in B accurately matches the reference product in A in form, color, material, and proportions.",OK,0,20260430-235019
napa-boardroom-conference-table,9724981215545,4,sceneB-smb,napa-boardroom-conference-table__pos4__sceneB-smb.jpg,https://cdn.shopify.com/s/files/1/0859/0413/0361/files/Napa-Boardroom-Conference-Table-Business-Interiors-16745453.jpg?v=1750124200,https://v3b.fal.media/files/b/0a9869cb/A9gY6NwIMr5qsx4tOcTrF_53c4d483fb8c444299906ad07c1f092d.jpg,/Users/leokatz/Desktop/Office Central/data/img2img/phase1/batch-11/napa-boardroom-conference-table__pos4__sceneB-smb.jpg,9,True,"The generated image accurately depicts the product in form, color, material, hardware, and proportions.",OK,0,20260430-235019
obusforme-comfort-medium-back-chair-fabric-1241-3-copy-1,9938997543225,2,studio-white,obusforme-comfort-medium-back-chair-fabric-1241-3-copy-1__pos2__studio-white.jpg,https://cdn.shopify.com/s/files/1/0859/0413/0361/files/business-interiors-default-title-obusforme-comfort-medium-back-chair-fabric-1261-3-schukra-42632855912761.png?v=1759098282,https://v3b.fal.media/files/b/0a9869c4/EAutmDpUIorE7cDttMuHH_077cf2859f4346c08f4b453f4727ed78.jpg,/Users/leokatz/Desktop/Office Central/data/img2img/phase1/batch-11/obusforme-comfort-medium-back-chair-fabric-1241-3-copy-1__pos2__studio-white.jpg,9,True,"The generated image almost perfectly replicates the product in the reference image in terms of form, color, material, hardware, and proportions.",OK,0,20260430-235019
obusforme-comfort-medium-back-chair-fabric-1241-3-copy-1,9938997543225,3,sceneA-institutional,obusforme-comfort-medium-back-chair-fabric-1241-3-copy-1__pos3__sceneA-institutional.jpg,https://cdn.shopify.com/s/files/1/0859/0413/0361/files/business-interiors-default-title-obusforme-comfort-medium-back-chair-fabric-1261-3-schukra-42632855912761.png?v=1759098282,https://v3b.fal.media/files/b/0a9869c6/IZ5TbX6_X-xbix1LlL59I_4adc29af44814a909745b0e70facd7de.jpg,/Users/leokatz/Desktop/Office Central/data/img2img/phase1/batch-11/obusforme-comfort-medium-back-chair-fabric-1241-3-copy-1__pos3__sceneA-institutional.jpg,9,True,"The generated image accurately replicates the product's form, color, material, hardware, and proportions in a realistic office setting.",OK,0,20260430-235019
obusforme-comfort-medium-back-chair-fabric-1241-3-copy-1,9938997543225,4,sceneB-smb,obusforme-comfort-medium-back-chair-fabric-1241-3-copy-1__pos4__sceneB-smb.jpg,https://cdn.shopify.com/s/files/1/0859/0413/0361/files/business-interiors-default-title-obusforme-comfort-medium-back-chair-fabric-1261-3-schukra-42632855912761.png?v=1759098282,https://v3b.fal.media/files/b/0a9869c7/nQQbH6Hiis841qZT3jdCh_b6cd058f19534f07898b78e169a22e32.jpg,/Users/leokatz/Desktop/Office Central/data/img2img/phase1/batch-11/obusforme-comfort-medium-back-chair-fabric-1241-3-copy-1__pos4__sceneB-smb.jpg,9,True,"The generated image accurately captures the form, color, material, hardware, and proportions of the reference product in a realistic office setting.",OK,0,20260430-235019
